<?xml version="1.0" encoding="UTF-8" standalone="yes"?>
<lionengine:pathfinding xmlns:lionengine="http://lionengine.b3dgs.com/xsd/10" xmlns:xsi="http://www.w3.org/2001/XMLSchema-instance" xsi:schemaLocation="http://lionengine.b3dgs.com/xsd/10 http://lionengine.b3dgs.com/xsd/10/game/feature/tile/map/pathfinding/pathfinding.xsd">
    <lionengine:tilePath category="ground">
        <lionengine:group>grassDark</lionengine:group>
        <lionengine:group>grassDarkBorder</lionengine:group>
        <lionengine:group>grass</lionengine:group>
        <lionengine:group>grassLightBorder</lionengine:group>
        <lionengine:group>grassLight</lionengine:group>
        <lionengine:group>grassBrightBorder</lionengine:group>
        <lionengine:group>grassBright</lionengine:group>
        <lionengine:group>road</lionengine:group>
        <lionengine:group>bridge</lionengine:group>
        <lionengine:group>treeCut</lionengine:group>
    </lionengine:tilePath>
    <lionengine:tilePath category="border">
        <lionengine:group>border</lionengine:group>
    </lionengine:tilePath>
    <lionengine:tilePath category="tree">
        <lionengine:group>tree</lionengine:group>
        <lionengine:group>treeBorder</lionengine:group>
    </lionengine:tilePath>
    <lionengine:tilePath category="water">
        <lionengine:group>water</lionengine:group>
    </lionengine:tilePath>
</lionengine:pathfinding>